{
  "id": "research-en-01",
  "scenario_id": "synthetic-sensor-study",
  "profile": "research",
  "language": "en",
  "prompt": "Write a short English research note from the synthetic study packet. Separate methods, findings, and limitations. Cite source IDs in brackets, preserve the uncertainty and scope, and do not invent statistical tests or causal evidence.",
  "sources": [
    {
      "id": "s1",
      "text": "This synthetic study evaluated 12 independent stationary flat-target calibration cases at 20–24 °C. Each case was measured once with method A and once with method B. Measurement order was not randomized."
    },
    {
      "id": "s2",
      "text": "Across these 12 synthetic cases, median absolute error was 0.18 mm for method A and 0.12 mm for method B. No inferential test or uncertainty interval was calculated."
    },
    {
      "id": "s3",
      "text": "The observations are consistent with method B reducing median error in this tested set, but do not establish that method B caused the difference or will improve error on other targets or temperatures. The study did not test moving targets."
    }
  ],
  "required_facts": [
    {
      "id": "r1",
      "text": "The evidence is synthetic: 12 independent stationary flat-target cases tested at 20–24 °C."
    },
    {
      "id": "r2",
      "text": "Each case was measured once by each method, and measurement order was not randomized."
    },
    {
      "id": "r3",
      "text": "Median absolute errors in the tested set were A=0.18 mm and B=0.12 mm."
    },
    {
      "id": "r4",
      "text": "No inferential test or uncertainty interval was calculated."
    },
    {
      "id": "r5",
      "text": "The observation does not establish causation or improvement outside the tested targets and temperature range; moving targets were not tested."
    }
  ],
  "allowed_transformations": [
    "Report the absolute observed median difference as 0.06 mm if both original method-specific medians are retained.",
    "Rephrase uncertainty without strengthening it.",
    "Use bracketed source IDs [s1], [s2], [s3]."
  ],
  "output_contract": {
    "format": "markdown",
    "required_headings": [
      "Methods",
      "Findings",
      "Limitations"
    ],
    "required_literals": [
      "0.18 mm",
      "0.12 mm",
      "12"
    ],
    "citation_style": "source IDs in brackets"
  },
  "rubric": {
    "critical": [
      "Changing a permission, necessary execution condition, or state-preservation boundary.",
      "Strengthening a conditional scientific finding into a universal or causal conclusion."
    ],
    "major": [
      "Changing a required value, unit, input/output identity, or important required fact.",
      "Omitting a required fact that does not meet the critical definition."
    ],
    "minor": [
      "A localized factual label error that does not change the decision or executable result."
    ],
    "style_only": [
      "Formatting, sentence length, and wording preferences with no change in meaning."
    ]
  },
  "synthetic": true,
  "executable": false
}
