{
  "id": "explanation-zh-01",
  "scenario_id": "rain-counter",
  "profile": "explanation",
  "language": "zh",
  "prompt": "根据给定的合成装置说明，向值班人员解释雨量脉冲如何变成记录，以及保存失败时为什么不能清零。覆盖所有必需事实；不要写操作命令，不添加来源未给出的测量精度或全天雨量结论。",
  "sources": [
    {
      "id": "s1",
      "text": "这是一台用于说明的合成雨量记录器。每个脉冲代表 0.2 mm 降水量；给定片段记录到 18 个脉冲。"
    },
    {
      "id": "s2",
      "text": "记录器每 15 分钟尝试保存累计脉冲数。只有保存成功后才把计数器清零；保存失败时保留累计值，等待下一次保存尝试。"
    },
    {
      "id": "s3",
      "text": "这些记录没有经过风致误差校正，也不能用于推断降雪量。给定片段不是全天记录，不能据此计算全天降水量。"
    }
  ],
  "required_facts": [
    {
      "id": "r1",
      "text": "每个脉冲代表 0.2 mm；18 个脉冲在给定片段中对应 3.6 mm。"
    },
    {
      "id": "r2",
      "text": "记录器每 15 分钟尝试保存累计脉冲数。"
    },
    {
      "id": "r3",
      "text": "只有保存成功后才能清零；失败时保留累计值供下一次尝试。"
    },
    {
      "id": "r4",
      "text": "记录未作风致误差校正。"
    },
    {
      "id": "r5",
      "text": "不能据此推断降雪量或全天降水量。"
    }
  ],
  "allowed_transformations": [
    "将 18 × 0.2 mm 计算成 3.6 mm。",
    "可调整讲述顺序和措辞，但保留条件、否定、数字及其单位。"
  ],
  "output_contract": {
    "format": "markdown",
    "required_headings": [
      "如何得到雨量",
      "保存与清零",
      "适用范围"
    ],
    "forbidden_actions": [
      "执行命令",
      "推断全天降水量",
      "推断降雪量"
    ]
  },
  "rubric": {
    "critical": [
      "Changing a permission, necessary execution condition, or state-preservation boundary.",
      "Strengthening a conditional scientific finding into a universal or causal conclusion."
    ],
    "major": [
      "Changing a required value, unit, input/output identity, or important required fact.",
      "Omitting a required fact that does not meet the critical definition."
    ],
    "minor": [
      "A localized factual label error that does not change the decision or executable result."
    ],
    "style_only": [
      "Formatting, sentence length, and wording preferences with no change in meaning."
    ]
  },
  "synthetic": true,
  "executable": false
}
